{
  "type": "object",
  "required": [
    "schema",
    "seed",
    "rule_version",
    "archetype",
    "style",
    "space_preset",
    "width_m",
    "depth_m",
    "floors",
    "parcel_polygon_m",
    "footprint_origin_in_parcel_m",
    "road_sides",
    "table_center_world_units",
    "building_angle_degrees",
    "capabilities_required"
  ],
  "properties": {
    "schema": {
      "type": "string"
    },
    "seed": {
      "type": "integer",
      "minimum": 0,
      "maximum": 4294967295
    },
    "rule_version": {
      "type": "number"
    },
    "archetype": {
      "type": "string"
    },
    "style": {
      "type": "string"
    },
    "space_preset": {
      "type": "string"
    },
    "width_m": {
      "type": "number"
    },
    "depth_m": {
      "type": "number"
    },
    "floors": {
      "type": "integer",
      "minimum": 1,
      "maximum": 8
    },
    "parcel_polygon_m": {
      "type": "array",
      "items": {
        "type": "array",
        "items": {
          "type": "number"
        },
        "minItems": 2,
        "maxItems": 2
      },
      "minItems": 3
    },
    "footprint_origin_in_parcel_m": {
      "type": "array",
      "items": {
        "type": "number"
      },
      "minItems": 2,
      "maxItems": 2
    },
    "road_sides": {
      "type": "array",
      "items": {
        "type": "string"
      }
    },
    "table_center_world_units": {
      "type": "array",
      "items": {
        "type": "number"
      },
      "minItems": 2,
      "maxItems": 2
    },
    "building_angle_degrees": {
      "type": "number"
    },
    "capabilities_required": {
      "type": "array",
      "items": {
        "type": "string"
      }
    }
  },
  "additionalProperties": false,
  "$schema": "https://json-schema.org/draft/2020-12/schema",
  "title": "Building generator request v1"
}
