{
  "schema": "sandtable.building-request.v1",
  "seed": 202,
  "rule_version": 1,
  "archetype": "corner_shop_3_fronts",
  "style": "Brick",
  "space_preset": "spacious",
  "width_m": 12,
  "depth_m": 10,
  "floors": 2,
  "parcel_polygon_m": [
    [
      0,
      0
    ],
    [
      16,
      0
    ],
    [
      16,
      14
    ],
    [
      0,
      14
    ]
  ],
  "footprint_origin_in_parcel_m": [
    2,
    2
  ],
  "road_sides": [
    "south",
    "east",
    "west"
  ],
  "table_center_world_units": [
    100,
    200
  ],
  "building_angle_degrees": 30,
  "capabilities_required": [
    "polygon_shell",
    "slab_void",
    "runtime_dogleg_stair",
    "animated_door",
    "interior_partitions"
  ]
}
